2008-12-29,0,"b'Today Israel takes down an entire apt building of civilians to kill the family of one man. In Canada, we call that  terrorism.'","b""Australia's topless ban to protect Muslims and Asians""",b'Israeli warship collides with boat carrying medical volunteers bound for Gaza',b'wife takes final pics of her husband in ER waiting room where he was told to wait while a virus ravaged his organs',b'It has started: Protests around the world against US and Israel',b'Israel pounds Gaza for fourth day - The massacre continues',b'Israel attacks a ship containing medical supplies',"b'If they are the greatest ally of the United States, why did they need to know about our missile defense system?'",b'Unacceptable! [News Photo]',b'Why America Needs to Stop Supporting Israel',"b""Holocaust 'greatest' love story a hoax""",b'Israel has banned reporters from the Gaza Strip -- only reporting from behind Israel lines is now allowed.',b'Ski jumper with the best distance record barred from Olympics.  For being female.',"b""Taliban militants beheading and burning their way through Pakistan's Swat Valley""",b'Israeli Navy Attacking Civilian Mercy Ship! ',b'Hundreds of demonstrators marched through the Swedish capital on Monday and set fire to an Israeli flag painted with a swastika',b'Crippled accounting standards: the cause of the economic crisis?',"b""Asian governments roundly condemn Israel's 'crimes' in Gaza Strip """,b'Chaos fear after President Abdullahi Yusuf of Somalia resigns',b'Israeli terrorists bomb a Pharmacy',b'Corruption taints every facet of life in China.',"b'Israeli warship orders boat carrying medical volunteers and supplies - with CNN reporter on board - to turn back to Cyprus, accusing the vessel of terrorist activity'","b'Hamas official blames rockets on ""Collaborators""'","b'Israel prepares for ""long weeks of action"" '","b""Ayatollah Sistani, whom Paul Wolfowitz lauded for 'the first pro-American fatwa', Calls on Muslims to take practical steps against Israel"""
2008-12-30,1,"b'Greece: Union activist loses her eye in acid attack. Her supporters blockade company. Riot police ""forced to run leaving shields, helmets and even shoes behind.""'","b'Israel has been in violation of international law since 1967, protected by the United States veto of UN Resolutions condemning Israel for its violent, inhumane, barbaric, and illegal acts.'","b'Zbigniew Brzezinski to Joe Scarborough on Gaza: ""You know, you have such a stunningly superficial knowledge of what went on that it\'s almost embarrassing to listen to you.""'",b'Iceland after the fall',"b'Russia is to shut off gas supplies to Ukraine, raising fears of European energy shortages'",b'Video about living conditions in Gaza (from 2007)',"b'""Here is a simple, stone cold fact. You cannot read or hear the truth about what is happening in Gaza from any corporate media in the United States.""'",b'MP wins support to ban topless sunbathing on Aussie beaches',"b""The IL Gov scandal is wrong, but almost EVERY election/bill/decision victory is directly correlated to the amount of money spent.  So, what ISN'T for sale?""","b""While everyone was focusing on Israel and Hamas, a terrorist organization elsewhere killed 189. Is a Palestinian's life more noteworthy than these people's?""",b'Christmas Massacres - Ugandan rebels kill 400 in DR Congo',b'Sex offenders must hand over online passwords',"b""Some Myths about Israel's Attacks on Gaza""",b'Does anybody really think Israel would be a peaceful nation even if the Palestinians gave all of their land to Israel?',b'This Sun Times story was censored for political reasons. No shit. Go ahead. Try to find the original. ',"b'The original, legal owners of the Israeli land on which Hamas rockets are detonating live in Gaza.'",b'The Emperor IS Naked - The story behind the Gaza initiative',"b""Iran shuts down leading reformist newspaper for criticizing Hamas' attacks and human shield use""",b'Volunteer suicide bombers seek to attack Israel',"b'Over 70,000 deaths, and over 1 million disabilities among American soldiers attributed to Iraq Wars'","b'Brigitte Bardot\'s ""Hate Crime"" Against Islam - Freedom of speach abolished in France (and in most of Europe)'",b'Israel calls Gazans to warn them to flee for their safety',"b'Israel: If this is how the Children of God act, what are the Children of the Devil,'",b'ABC News: All (Illegal Immigrants) Aboard ICE Air',"b""Polygamy in the UK : Woman didn't know new husband was already married."""
2008-12-31,1,b'Former Army Employee Pleads Guilty to Acting as Israeli Spy',b'Graphic pictures of what the Israeli war machine does to Palestinians.',"b""Icelandic TV program featuring PM forced off the air when a torch-wielding crowd stormed Reykjavik's Hotel Borg in an attempt to get to the studio. A torch-wielding crowd. Sweet.""","b""Gazprom cuts off Ukraine's gas supply.""","b'IDF Claims to have Hit Hamas Truck, Human Rights Group Finds 8 Civilians Dead and No Hamas'","b""Daniel Barenboim: If Hamas is destroyed, a more radical group will replace it. Israel's security depends on wiser action""",b'Israel and Gaza - Pictures',b'Greece: The left is full of puppet organizations that defer and defend the right and the existing order. The Greek people have no alternative but starting from scratch. ',"b'""The land is fertile, the rain is falling, but the agricultural system has been destroyed by Robert Mugabe""'",b'UK telecom firm severs ties with Israeli company due to Gaza attacks',"b""Gaza's tunnel economy collapses in bombing raids""",b'Rotten state of Egypt too powerless and corrupt to act',b'No wonder it burnt to the ground - Cellphone footage shows hundreds of sparklers inside Bangkok club minutes before Deadly fire',b'In Pictures: Massacre of Gazan Children ',b'New Norway law bans buying of sex ',b'Israel stifles free press covering Gaza',b'Extreme seismic conditions return to yellowstone - Could be a big big bang for the new year!',"b'Israel kills top Hamas figure, escalating campaign'",b'*warning: may contain shocking images* Full Footage of the fire at Bangkok Nightclub Santika',"b'Israelis, Hamas continue bombing reddit. Cease-fire demanded.'",b'Nothing like a fresh Israeli offensive to bring out the Jew in me',b'Russia prepares to halt gas supplies to Ukraine',b'Vanity Fair: An Oral History of the Bush White House - an amazing collection of interviews',"b'Israel Rejects Cease-Fire, but Offers Gaza Aid'","b'The Arab Conscience: A 40 minute song performed by many major Arab pop singers. ""The Woodstock of this generation in the Arab world"", according to Juan Cole.'"
2009-01-02,1,b'Australia refuses Bush administration request to house Guantanamo detainees',b'Propaganda war: trusting what we see?',"b""CNN: US weapons 'killing innocent civilians' in Gaza""","b'""Let us not forget that it was Israel, which in fact created Hamas"" Historian at the Hebrew University of Jerusalem'","b""Northern Ireland man discovers 'secret of invisibility'""",b'Lynndie England: Life after Abu Ghraib',b'Zimbabwean lawyer: Law has broken down - CNN.com',b'Nobel Peace Prize laureate Shirin Ebadi of Iran is threatened at her home ',"b'Beijing moves to stifle reform calls, called the most significant of its kind for at least a decade and possibly since the 1989 Tiananmen Square protests. '","b'Israels Goal - Ending Hamas Rule, Rocket Fire, or Both '","b""Memo to Israel: Dropping Leaflets and Sending Text Messages Won't Abosolve You of War Crimes""",b'Gang rapes lesbian',b'The Cost of Governing Afghanistan',b'Israel expels UN rights envoy Richard Falk - Dec 17 08',b'Who Gets U.S. Foreign Aid',b'Hamas PM Ismail Haniyeh at war with Israel  and his own rivals',"b'Police have dispersed crowds of demonstrators who gathered near the Israeli embassy in London, following a day of protests across the UK.'",b'Sri Lanka bombs Tigers in north after fall of HQ',b'Israel bombs market in Gaza (warning: graphic)',"b""'We Believe This was a Legitimate Target' - IDF Kills 8 Civilians, 4 Under the Age of 18""",b'Queen goes green as her 10million Bentleys are converted to run on biofuel',b'Living in fear in Gaza City!',b'Israeli Troops Launch Attack on Gaza',"b'Shut down al-Jazeera - ""The situation on the ground is directly affected by the nature of al-Jazeera reports."" [Ynet Opinion Piece]'",b'Why is Israel so brutal in a nutshell - from The Independent'
2009-01-05,0,b'Palestine Girl stands up to Israel Soldier ',b'Israeli Strike Kills 40 at U.N. run School in Gaza ',"b'Norwegian doctor in Gaza: ""This is an all-out war against Civilians""'","b'Between 600,000 and 700,000 Gazans have no water, some of them going on a week. About one million have no electricity, raw sewage is running in the streets in some places.'","b'Ron Paul: ""No one mentions the tragedy in Gaza.  I view it (Gaza) as a concentration camp.""'",b'UK police have been given the power to hack into PCs without a court warrant',"b""Strike on Gaza school 'kills 40'""","b""GAZA PIC's. WARNING :VERY GRAPHIC!!!!!!!!!""","b'""We are wading in death, blood, and amputees. Many children. A pregnant woman. I have never experienced anything so terrible.""  Mads Gilbert, Norwegian doctor in Gaza'",b'Several European countries say they have suffered major disruption to their Russian gas supplies after Moscow cut deliveries to Ukraine',"b'Israel using new deadly weapons in Gaza: Dense Inert Metal Explosives. Appeal of Mads Gilbert, Norwegian doctor in Gaza to Israeli doctors'",b'Venezuela expels Israeli ambassador',"b'Mads Gilbert, a Norwegian doctor in Gaza, tells CBS News that the number of civilians injured and killed in Gaza proves that Israel is deliberately attacking the population [Vid]'",b'Israeli forces hit UN school... on purpose.',b'Where does U.S. oil come from? (cool interactive map)',b'Whenever I read a story like this I think of my little boys and become enraged with the state of affairs in Gaza',"b""'As I ran I saw three of my children. All dead'""",b'IDF routinely attacks medical crews trying to evacuate civilian casualties',b'U.N. Official Says Gaza School Hit by Israelis was Clearly Marked',"b'""Working on this issue for six Secretaries of State, I cant recall one meeting where we had a discussion with an Israeli PM about the damage that settlement activity does to the peacemaking process.""'",b'The Raw Story | Norwegian doctor: Israel intentionally targeting civilians',"b""Madoff apparently still hasn't got the message that its not 'his' money""","b""Norway's sovereign wealth fund to stop investing in Israel?""",b'The brutal collective punishment inflicted on Gaza will likely strengthen Hamas and reverse any hopes of a Middle East peace in the coming years. ',b'Reporter reports on father killed by an Israeli air strike in Gaza'
2009-01-06,1,b'Anyone know if this is true?',"b""British Gov't wants private firms to build $12b super database for tracking every citizen's Internet usage, phone call,  text message, and other transactions""",b'Israeli Tank fire kills dozens at UN School. Tank fire. School.',"b'Bush Aides: ""Historians will judge Bush."" Redditors and the rest of the world: ""The Hague War Crimes Tribunal will judge Bush""'","b""Russia has cut off all Europe's gas supplies, says Ukraine""","b'""Israel, not the Palestinians, has opposed international UN monitors in the conflict since Oslo""'",b'Venezuela expels Israel envoy over Gaza attacks',b'This is what happens on the streets of Israel if your not a jew. They obviously love Americans.',b'Israeli soldiers entered their building and told them to evacuate to another building. They evacuted and moved to another place for shelter.  Israel bombs their shelter.',"b'""Almost a third of the 689 Palestinians killed in Israel\'s Gaza offensive are children"" ... Meanwhile, Israel\'s Foreign Minister Livni says that ""there is no humanitarian crisis in Gaza""'",b'UN: No Hamas Fighters in Bombed Gaza School',b'Red Crescent ambulanceman killed and two others wounded as ambulances come under Israeli fire in Gaza:  International Red Cross ',b'Jewish Women Occupy Israeli Consulate in Toronto',b'Digg vs. Reddit prespective on Israel Gaza conflict',"b""Obama's comments on Gaza not being reported in the US media?""","b'""We cannot promote a fuel anymore which is used as a weapon by some countries and certain corporations against consumers.""'",b'Gazprom Halts Gas Supply to Europe Via Ukraine Pipes',"b'As temperatures fall to below freezing, Russia cuts off gas supply to Europe'",b'Middle East observers felt a sense of dja vu as Israeli tank shells slammed into a United Nations school near Gaza City',b'Financial Fraud in Satyam Computers Brings its Shares as low as Rupees 30.70/share',"b'While we merrily sip their water, a third of Fijians have no clean water at all'",b'At least someone has balls. I hope it is the start.',b'Temperatures in Germany fell as low as minus 25 degrees Celsius on Monday night and the weather is expected to remain Arctic for several days.',"b'Time to stfu and listen: Infowars predicted financial meltdown long before you could scream ""tinfoil hat""'",b'Sarkozy says Israel and the Palestinian Authority have accepted a truce plan for Gaza announced by Egypt on Tuesday.'
2009-01-07,0,b'You are being lied to about pirates',b'Rockets hit Israel from Lebanon',"b'I arrived in Israel 40 years ago. It took me many years to understand that the very existence of my country, as it is today, is based on an ongoing ethnic cleansing of Palestinians.'","b'Red Cross finds four small children in Gaza, huddling next to their dead mothers, too weak to stand up ... ""Israel has failed to meet its obligation under international humanitarian law""'",b'UN: Israel kills driver on aid mission to Gaza',b'Israel kills driver of UN truck on aid mission to Gaza',"b'These photos, taken in Gaza in 2006, show the impact of the DIME bombs the Israelis are allegedly using there (warning: extremely graphic)'","b""The Bush Administration's Most Despicable Act""","b""TED: Hans Rosling: Debunking third-world myths with the best stats you've ever seen""",b'Gaza is full-blown humanitarian crisis',b'The Red Cross has accused Israel of failing to fulfil its obligation to help wounded civilians in Gaza',"b""Canada extradites another American war resister. This one's a mother of three who has a six-week old child. Stay classy Canada!""","b'Sri Lankan newspaper editor ""meticulously collected the facts, which was why so many politicians feared him."" He was shot dead today by unidentified gunmen.'","b'UN: ""Israel knew they were bombing a school"" [vid]'","b'Extremists on each side sustain the other, and the excessive Israeli ground assault in Gaza is likely to create more terrorists in the long run'",b'U.N. suspends all relief work in Gaza; says Israeli soldiers fired on a marked U.N. vehicle DURING the ceasefire.',"b""Red Cross finds starving children with 12 corpses in Gaza 'house of horrors' """,b'Kucinich stands against the use of US arms against innocents in Gaza',"b'The IDF has been dropping leaflets in Gaza with a phone number to call to report on ""terrorists"". Here\'s one of the calls (with translation).'",b'South Korea tested whores so they were disease-free for U.S. soldiers',"b'Bush: ""Eighteen months ago, Hamas took over the Gaza Strip in a coup"" And people suggest there isn\'t a ridiculous Israeli bias amongst US polticians?'","b'While the world watches Gaza, Israelis are shooting protestors in the West Bank'",b'China Losing Taste for Debt From U.S. ',b'Rockets fired from Lebanon into Israel and Israel fires back',"b'More than a thousand Afghans signed up to go and fight Israel in the Gaza, many of them blaming the US which has some 30,000 troops in Afghanistan, for supporting the Jewish state.'"
2009-01-08,0,b'Vatican: Gaza is a giant concentration camp',b'Israel shelled Gaza house crowded with civilians: witnesses',"b'Red Cross: Israel breaking international law, letting children starve in Gaza'","b'Israeli army ordered 70 persons of extended family to gather in one building. The next morning the same army bombed the building, Killing and injuring dozens.'",b'Israel Faces Mounting Outcry on Gaza War - NYTimes.com',"b'Israel bombs a shelter, kills 30 civilians'",b'Israel accused of delaying medical access to injured',b'Israel to continue offensive despite UN resolution ',"b""The Army's Newest Recruitment Technique is aimed directly at gamers. ""","b""Atheist Bus Campaign is 'offensive', say 50 complainants""","b'""The IDF is investigating"": just another way Israel says \'fuck you\' to humanity'",b'Few speak up for Palestinians in U.S. Congress',"b""Early Globes 'winner' was a mistake """,b'Israel keeps tight leash on media',b'Relief workers found starving children next to corpses in a neighbourhood of Gaza City which Israel had denied them access to for days',b'And why the problem in the Middle East will never get solved: US congress votes to back Israel: 390 to 5',"b'Gaza: Palestinian journalist, his wife and mother-in-law killed by Israeli artillery'","b'Israel shelled Gaza Palestinians after evacuating them, UN says'","b'Israel deliberately shells a UN convoy carrying aid into Gaza after giving them permission to go through...Israel, the ultimate terrorist nation'",b'Emergency workers said they rescued 100 more trapped survivors Thursday and found 40 - 50 corpses in a devastated residential block south of Gaza that the IDF had kept off-limits to the RC for 4 days',b'Israeli attacks are rallying Palestinians to Hamas',"b'The penalty for underfeeding thousands for years to make a $200K profit? One day in jail and a pledge to ""do better.""   '","b'Large portion of Washington State underwater, buried by avalanches, or washed away by mudslides.   Thousands told to evacuate.'",b'I Am Opposed to Violence by Jewish Fundamentalists OR by Islamic Fundamentalists OR by Christian Fundamentalists OR Hindu Fundamentalists',b'Hamas has failed  it is time they stepped down - The National Newspaper (Abu Dhabi)'
2009-01-09,0,"b""Enough. It's time for a boycott""","b'Norway Leads: 40 000 people gathered in Oslo for Gaza Thursday, 8th January 2009. Thursday ALL trains in the whole of Norway, and all trams and subways in Oslo, will stand still for two minutes.'","b'Eco Activist Buys Drilling Rights for 22,000 Acres - Refuses to Drill'","b""Israel Is Committing War Crimes - Hamas's violations are no justification for Israel's actions. (from WSJ)""","b'Despite Israeli denial, newly found photographic evidence proves that Israel has used controversial white phosphorus shells on Gazans. '",b'U.S. seeks ship to move arms to Israel',"b'Thousands of demonstrators in Barcelona, Spain call for an immediate ceasefire in the conflict in Gaza'","b""Israeli Spokesman is Silenced by Alex Thompson of UK's Channel 4 regarding the IDF and the Red Cross""",b'New Orleans cops shoot man 12 times - in the back',"b'LET GAZA LIVE!  D. C. Protest Saturday, January 10 - Assemble at the White House (north side) at 1:00 PM'",b'U.S. says arms shipment to Israel not linked to Gaza. US also says that Elvis is still alive.',b'Israel Is Committing War Crimes ',"b""'I Would Join a Terror Organization': Current Israeli Defense Minister explained in 1998 what he would have done if born Palestinian.""",b'Former [Israeli] pilot: Israel committing war crimes in Gaza',b'Real Journalism : The way questions should be asked - Dennis Kucinich vs. Eliot Engel',b'Hugo Chavez Expells Israeli Ambassador to Venezuela',"b""Iraq Veterans Against the War - Why we're against the war""",b'Jimmy Carter - An Unnecessary War (in reference to the Gaza crisis)',b'Nowhere to run: More than 260 children killed in Gaza',b'Five of the Somali pirates who released a hijacked oil-laden Saudi supertanker drowned with their share of a reported $3 million ransom after their small boat capsized',"b'Many may think that the current economic fiascoes are the results of bungling politicians and bureaucrats. FDR once said, In politics, nothing happens by accident. If it happens, you can bet... '","b'India shows the way! sends CEO, COO and CFO of Satyam who scammed a billion dollars to the slammer!'","b'US In Massive ""Rare"" Arms Supply to Israel Days Before Obama Inauguration'",b'There have been no rockets fired from the West Bank for several years. The result? A record number of new settlments built.',"b'""Pandas are actually bears, not cats."" Chinese Panda Attacks Third Idiot'"
2009-01-12,0,"b""The video the Israeli Army didn't want you to see """,b'Momentum growing for Israeli war crimes investigation',"b'Israeli Sightseers Flock to Border to Watch Gaza Killings - ""They come with binoculars. They bring their families and take pictures. They rationalize away the deaths of hundreds of children ...""'",b'Kucinich: 50 Percent of the Population of Gaza Under 14 Years of Age!',b'Palestinians call to Greek people: Block the shipment of US arms to Israel through Greek ports',"b""Let me say it loud and clear. I do not believe in Israel's right to exist. It is a militarised, evil entity founded on a racist premise and a lot of religious hokum - Craig Murray, Former UK diplomat""","b'Construction workers in Poland found a WW2-era mass grave containing what are believed to be the bodies of 1,800 German men, women and children who disappeared during the Soviet march to Berlin'","b""Israel's claim to be a bastion of democracy in the Middle East is now in jeopardy with its crackdown on its Arab citizens""",b'I never knew Sky News was so biased. George Galloway making the news caster earn her wage!',"b'Israeli President said, ""Yes, that\'s true, there are many palestinain children and very few Israeli children casualtieies, but that is because ""we take care of our children.""'","b'""I hope my murder will be seen not as a defeat of freedom but an inspiration""'","b""Red Cross: Israel's use of white phosphorus not illegal""",b'Israeli soldiers reportedly shot woman waving white flag',b'Any Palestinians on reddit?  Come on in and give us your own view on the Gaza conflict.',"b'The USSR built power plants, dams and factories in Afghanistan. The US can barely keep the lights on or water running there. Who were the bad guys again?'","b'Israeli tanks rolled into Gaza City from two directions early Tuesday after UN Secretary-General Ban Ki-moon called on both sides in the conflict to just stop""'","b'""The BBC, which we call the Bush and Blair Corporation..."" British MP George Galloway on the Palestinian Situation. Amazing.'",b'Unusually Large U.S. Weapons Shipment to Israel: Are the US and Israel Planning a Broader Middle East War?',b'Who thinks Israel is helping America head towards another 9/11?',b'New Face Recognition Technology Should Worry British Citizens. ',b'Poland: Workers find WWII mass grave of Germans',b'Israel losing PR war',b'Rabbi against Zionism.',b'The Times Online: No room for more graves in Gaza cemeteries',b'German Protestors Compare Gaza to the Holocaust.'
2009-01-13,0,b'Greece hinders US arms delivery to Israel',"b""Canada: We're the only one of 47 nations on UN rights panel to refuse to condemn military offensive in Gaza""","b'Israeli newspaper: ""Palestinian doctor killed by IDF while treating Gaza wounded.""'","b'Bodies are ""piled up like logs"" in Zimbabwe\'s cholera crisis'","b'We the undersigned are all of Jewish origin: ""The time for appeasing Israel is long past""'","b""Former Israeli Foreign Minister Appears On UK TV, Says Israeli Intelligence 'Inventing Facts'.""","b'Pro-Israel Rally For Attacking Gaza, NYC, 1-11-09 - ""Wipe them all out!"" - including prominent politicians supporting the rally.'","b""Pro-Israel Rally Attended by Big-Time NY Dems Descends into Calls for 'Wiping Out' Palestinians ""","b'Canada\'s ""Liberal"" leader: ""Israel has been attacked from Gaza, not just last year, but for almost 10 years. They evacuated from Gaza so there is no occupation in Gaza.""'",b'Israeli Troops Ordered to Shoot Rather Than Ask Questions',b'Bolivia breaks ties with Israel',b'Sri Lankan death squads kill editor and ransack TV station',b'Experts say that claims the internet and social networking services pose a threat to children are overblown',b'Nine Jewish Israeli human rights groups called for an investigation into whether the IDF had committed war crimes in Gaza.',"b'If you want to understand the mindset of Israel watch this ... its called the ""break the bones"" strategy from the first intifada ... kinda graphic.'",b'Israel may face UN court ruling on legality of Gaza conflict',b'Crisis Worsens for Civilians in Gaza',b'UN finds 217 sex abuse claims against blue helmets',"b'Egyptian Government Daily: Hamas, Syria, Iran - The New Axis of Evil'",b'Israeli navy refuses to let an Iranian aid ship dock in Gaza.',"b'More than 1,000 killed in Gaza - When will this end?'",b'Stunning photos capture Israeli bombs falling on Gaza (series of photos)',b'China to Pass Germany as Worlds Top Exporter in 08',"b'Czech EU art stokes controversy: displays France as country on strike, Bulgaria as toilet, Romania as Dracula theme park ...'","b""What's All The Fighting For, And Where? [Infographic]"""
