2008-10-17,0,b'The Other Man On The Podium',"b'Dutch non-profit reproductive health organization sails ship around the world, anchoring in international waters to provide abortions to women in countries where abortion is banned'","b""Grand Ayatollah Issues Decree Calling Muslims to Defend Iraq's Christians""",b'Marx Das Kapital sales soar among young Germans ',"b'A man in England killed his wife because she changed her Facebook relationship status to ""single""'","b'Georgia Used Cluster Bombs in August War, Too'",b'Arctic Temperatures Break All-Time Recorded High',"b'Reddit, please send help, (UK) politicians insane. Apparently not monitoring mobile and web records would be ""giving a licence to terrorists to kill people""'","b'Wow. ""Secret coded messages are being embedded into child pornographic images, and paedophile websites are being exploited as a secure way of passing information between terrorists.""'",b'England to run out of honey before Christmas after catastrophic honeybee decline ',b' Iran to stop executing youths',b'China watches over internet caf customers in web crackdown ',"b'China\'s media ""freedoms"" are reduced. New measures include cameras in internet cafes and pictures taken of all users'",b'Bali bombing - new suspects',b'Hindu American Foundation petitions the NY Times to focus as much on the activities of Christian missionaries in India as it does on anti-Christian violence.',b'A quick overview of how Islamic terror organizations get their funding.',b'Last Titantic Survivor to Auction Off Mementos to Pay for Nursing Home - We can do better!',b'Hungary Gets $6.7B Loan to Avert Meltdown ',"b'Sao Paolo : Hundreds of black-clad military police fired teargas, stun grenades and rubber bullets at striking civilian officers seeking a 15 percent pay raise'",b'Austrailian historian arrested for Holocaust denial',b'Defense Secretary Gates said he is prepared for reconciliation with Taliban as part of the political outcome in Afghanistan',"b'Is Switzerland the next Iceland?  ""Switzerland was forced to take emergency measures yesterday to shore up its two biggest lenders to prevent a collapse in confidence in the country\'s banking system.""'",b'Police battle police in Sao Paulo',b'25 more civilians killed in NATO air strike in Afghanistan: villagers',b'The West Is at a Loss in Afghanistan'
2008-10-20,1,b'Coke Dealers Badass Party House w/ Private Zoo',"b'Japan: 44 per cent of country\'s workforce are part-time only. Communist-themed ""manga"" comics are enjoying soaring success.'","b'Seriously, what\'s going on in China that would cause melamine in everything from milk to dogfood... and now chocolate and strawberry flavored ""willy spread""?'",b'Fascinating Pictures of Russian Trains ',b'Activists celebrate Irans ban on juvenile executions',"b'New Security Scanners Called ""Virtual Strip Search"" at Melbourne Airport Will Show Genitals!'",b'Beijing Olympic Official gets the Death Sentence.',b'Rwanda abandons French language',"b'Convert or we will kill you, Hindu lynch mobs tell fleeing Christians'",b'A split in Belgium?',b'Pakistan facing bankruptcy as world financial crisis deepens',b'Trial of 86 nationalist hardliners accused of using assassination and bombings in an attempt to overthrow the Islamist-leaning Turkish government is postponed when supporters flood the courtroom.',"b""Burros carry one man's library to Colombian villagers""",b'UK borrowing at 60-year high',b'Did a Gulf of Tonkin Incident Just Happen In Iranian Waters?',b'Vietnamese Security Police Again Active in Poland',b'Really? Iran Security Forces arrest pigeons working for imperialists equipped with metal rings and invisible strings near Natanz nuclear facility',"b'China to Allow Land Leasing, Transfer. New Law Is Part of Project Aimed at Doubling Rural Incomes'",b'Sri Lanka MoD says 33 troops died fighting Tiger rebels over the weekend. Here are some govt. videos.',"b""Muslim fanatic prisoners to be 'de-programmed' using controversial techniques to 'cure' them of beliefs""",b'Bank hackers steal from French President Sarkozy',"b""Drug violence traumatizes Mexico's children.""",b'Almost 200 UFO files will be made available by the MoD over the next four years.',b'Israel Considering Saudi Peace Deal',"b""British spinster jailed after breaking neighbour's arm with spade"""
2008-10-21,0,"b""Britain's freedoms under threat from 'Big Brother security state', warns Director of Public Prosecutions""","b""Centuries of freedoms being broken by security state, says England's top prosecutor""",b'Newly declassified documents: Stalin was ready to send over a million Soviet troops to the German border in order to preempt Nazi aggression. This could have prevented the outbreak of the World War II',b'Providing micronutrients for 80% of the 140 million poorest children in the form of vitamin A and zinc would cost $60 million/year. This action holds benefits of more than $1 billion/year.',"b'China accuses US of ""widespread human rights abuses on its own territory"" and hypocrisy in criticizing others'","b""A Photo Essay on Vietnam's Forest Pygmies: Only discovered in the 1980s, this is Vietnam's Smallest Indigenous Minority (in both senses of the word)""","b""'More inequality' in rich nations""",b'Terrorism Act',b'Bali bombers to be shot dead after losing court appeal to be beheaded',"b'1917 Baron Rothschild was the addressee of the Balfour Declaration, which committed the British government to the establishment in Palestine a national home for the Jewish people.'",b'Somalia frees hijacked cargo ship',b'What are the Japanese doing right now? Minute by minute graphs from the best census keeper on earth',b'Bali bombers to be shot to death',b'Canada had role in torture of its nationals: probe',"b""Mobile's missed calls that reveal 'terrorists tried to detonate car bombs 15 times in central London'""","b""Lloyd's of London, the world's biggest insurance market, said Tuesday that Hurricanes Gustav and Ike will cost it at least $2.34 billion in damages claims.""","b""Amnesty International says Nigeria's criminal justice system is so flawed, it's calling for a moratorium on executions to avoid the deaths of innocents.""","b""Mao Zedong's only grandson leads Maoist revival""",b'Counter-Terrorism Bill clause 83 reminder - chilling effect on reporting or speculation about military or intelligence service or police personnel ?',"b'In Algeria, death sentences follow fugitives thick and fast'",b'French Bistros File Record Bankruptcies as French surrender their culinary pride to Le Big Mac',"b'Botswana brides: Buy now, pay later'","b""ANC call on SA land redistribution described as 'reckless'""","b""Army scientists 'deployed in UK'""","b""Sarkozy pushes eurozone 'economic government'"""
2008-10-22,0,"b'US falls to 119th out of around 160 countries ranked by press freedoms outside its own territory, says Reporters Without Borders.'","b""Austria in shock as leader of far right Alliance for the Future of Austria reveals he's gay - and was having a long-term affair with Jorg Haider, the former leader""","b""BBC: India successfully launches the unmanned Chandrayaan 1 spacecraft - the country's first mission to the Moon""",b'Moon rocket at an Indian price: Just 80 million dollars to the moon',"b'Despite intense U.S. pressure, Pakistan refuses to buy the ""with us or against us"" worldview and are edging closer to talks with the Taliban, saying, ""What\'s wrong with talking?""'","b'Kristallnacht remnants finally unearthed near Berlin, close to 70 years on'","b'Surprisingly enough, Chagos Islanders lose the latest round in their battle to return to their home, stolen from them by the UK'","b'Russia, Iran and Qatar announce an OPEC-style ""big gas troika"" that will control 60% of the world\'s gas supplies.'","b""Women who switched roles to live lives as men. Last of Albania's 'sworn virgins'""","b'Chinese call Microsoft the ""biggest hacker in China, with its intrusion into users\' computer systems without their agreement or any judicial authority"".'",b'Dutch police official on coffeeshops and the meshing of legal and illegal drug trade',b'A skyscraper in Mecca catches fire. Does anyone have more on this?',b'Ouch! Wachovia Reports $23.9 Billion Loss for Third Quarter',"b'Dear Mr. Brown, we are not terrorists'","b""Chagos Islanders, comprehensively screwed over by the UK and US governments, may have a chance of returning to their stolen homeland (but don't hold your breath)""",b'It is more important to be attractive than to be right',b'Civilian deaths from US/Nato air strikes in Afghanistan are not accidents or mistakes  they are calculated and predicted',b'UK Government tied in knots by bondage protest',"b'Nicolas Sarkozy threatens to sue over ""voodoo doll"" that tells people to stick pins into his body'",b'Jamaica beach vanishes in crime wave',b'Economic downturn likely to cause British recession: Brown',b'35 Taliban reported killed in Afghan battle....Just how many of these f*ckers are there?',b'Mexico arrests suspected major cocaine trafficker after shootout',b'Donors pledge 4.5 billion dollars to Georgia',b'Mountain range that rivals the Alps may prove that Antartica was once part of Western U.S.'
2008-10-23,1,"b'Argentina nationalizes private pensions and acknowledges that they were an ""enormous error\'\'. Argentina takes action to protect workers and retirees instead of banks. '",b'How people of other religions are treated in Muslim countries: Amazing facts.',"b'Baby rape a cure for AIDS - How can this be sick belief be common in a developed country? over 1500 new infections daily, over 20,000 rapes a year'",b'UN says wealth gap creating a social time bomb - Growing inequality in US cities could lead to widespread social unrest and increased mortality.',b'Another war? Bosnia in real danger of collapse',b'Israeli Revealed as owner of South Sudan bound weapons ship',"b'EU awards its Sakharov Prize for Freedom of Thought to jailed Chinese dissident Hu Jia.  China\'s Foreign Ministry calls it meddling but ""too trivial to dwell on.""'",b'Mexican Government Covers Up Murder of Journalist',b'Pakistan stares into the abyss',b'Massive Secret Uranium Shipment Revealed',b'Pakistan Will Give Arms to Tribal Militias.  What could go wrong?',b'Pakistan: 8 Students Die in Suspected US Missile Strike on School',b'Russians told all is well as economy sinks',b'Adolf Hitler and the Nazis were working on a Big Brother-style cable television propaganda industry to be broadcast across Germany',b'Far-right Austrian leader sacked for revealing gay affair with Jrg Haider',b'US airstrike kills 9 Afghan soldiers at checkpoint',"b'US, British ex-diplomats warn Bosnia in danger of collapse'",b'UN warns of mass starvation in North Korea',b'Horrific Flashback From My Soviet Childhood',b'Pakistan takes $5bn IMF bail-out after allies refuse funds',b'Russia Backs Keeping U.S. Force in Iraq',"b'GOP Donors Critical of Palin\'s Pricey Threads; Some Want Money Back (""..like to think they were successful enough to [get] their wardrobe with their own money"")'",b'India Launches Moon Mission',b'Mobile biometric scanners for all UK police',"b'""V"", ""U"" or ""L"" shaped - the shape of the coming global recession [Hint: L shaped is bad]'"
2008-10-24,0,b'EU formally renews ties with Cuba ',b'Terrorism laws can be abused to stifle dissent: UN rights expert',b'Colombia: Half a million people on strike in the nation that kills more union members than the rest of the world combined.',b'Australia uses accusations of child abuse to take land from Aborigines for uranium mines',"b"" Aussie govt: Don't criticize our (terrible) 'Net filters""",b'German banks wants bonus repayment repayed from former managers.  Nice lead Germany',b' Oil falls nearly $5 as OPEC cut fails to halt slide ',b'U.S. Student Jailed In Iran',b'Resurgence of anti-semitism in Germany',"b""The United States has plundered global wealth by exploiting the dollar's dominance, and the world urgently needs other currencies to take its place: China paper""","b'North Korea faces worst food crisis in decade - Millions of people in the country are facing ""severe deprivations"" not seen since the mid-1990s'","b""Airport Striptease: Germany Shies Away From 'Peeping Tom' Airport Scanners""",b'Russian default risk tops Iceland as crisis deepens',b'EU defies Beijing warning to award Chinese dissident human rights prize',"b'Deputy Governor of the Bank of England: ""This is a once-in-a-lifetime crisis and possibly the largest financial crisis of its kind in human history"" '",b'Eastern European economies face bankruptcy',"b""Stephen Hawking to retire as Cambridge's Professor of Mathematics""","b'The arrest of Pinochet -- 10 years later. 30,000+ victims, 38 convictions.'","b'""I\'m in search of Gandhi in the land of Gandhi,"" he added. ""I\'ve failed to find him.""'","b""Russia's financial crisis is escalating with lightning speed as foreigners pull funds from the country and the debt markets start to price a serious risk of sovereign default.""",b'North Korea clamps down on mobile phones to stop news of food crisis',b'Iran holding American student in prison',"b""UK's highest court has criticised Islamic law for discriminating against women following a case in which a mother was forced to flee to the UK from the Middle East""","b""Iran accuses US of 'pillaging' Iraq ""","b""Rumors flurry about Ahmadinejad's health following event cancellations."""
2008-10-27,0,b'BBC: Rampant Evidence That Georgia Committed War Crimes During Conflict With Russia',b'Is Britain on its way to becoming a surveillance society. Or has it already arrived?',b'Extremists to be barred from UK',"b'1000 Congolese citizens hurl rocks at a UN compound, ""angry that a 17,000-strong U.N. peacekeeping force has been unable to protect them from a rebel attack just 25 miles north of the city.""'",b'Happy Diwali ',b'UK parents to be fingerprinted by nursery schools',b'Europe on the brink of currency crisis meltdown ',"b'Defectors describe executions, torture in North Korea'","b'The 255th death due to lack of medical treatment resulting from the seige on Gaza passed away, Monday'",b'How then did a Victorian working class family with four children enjoy a nutritious if unsophisticated diet on a budget of less than 2 per week?',"b""A news story that's remarkable for giving a much rounder than usual picture of civilian responses to the Islamist stoning of a woman accused of adultery.""","b""North Korea's military threatened to use everything in its arsenal to reduce South Korea to rubble unless Seoul stops civic groups from sending anti-Pyongyang leaflets into the communist state.""",b'A woman in Somalia has been stoned to death after an Islamic Sharia law court found her guilty of adultery',"b""Chile's torture colony -  Colonia Dignidad """,b'Right By My Side Where You Supposed To Be:  We might be on the verge of a major breakthrough with the Taliban',b'Italy: mega-march against Berlusconi',b'Iraq demands all US troops out by 2011',"b'IMF may need to ""print money"" as crisis spreads '","b""Refugees Australia rejected 'killed by Taliban'""","b""'Bush's Way of Waving Goodbye to Syria?'""",b'UN atomic energy chief warns of nuclear theft ',b'China May Lend Russia $25 Billion as Part of Oil Deal ',"b'Q&amp;A: Why is Congo in the news, and what role is the UN playing?'","b""I don't get it? Are people who insist on warring against the WRONG Country stubborn, or stupid, or evil?""","b""Iranian general admits supplying weapons to 'liberation' fighters in middle east"""
2008-10-28,1,"b'Finnish e-voting system loses 2% of votes, has no paper trail'","b'One dead, thousands without power and the first October snow in London in 74 YEARS as Arctic blast sweeps across UK'","b'Gordon Brown\'s terror claims for ID cards are ""bunkum"" says GCHQ expert'","b""mental midgets at tsa will eventually re-allow us to bring our non-explosive liquids back on planes! now if they'll just stop stealing our crap""","b'Over 1,000 foreign soldiers killed in Afghanistan since 2001'","b""Report: N. Korea's Kim suffers `serious' setback""","b'UK doctors warned ""we\'ll report you to MI5"" over IT security'","b'UK will face peak oil crisis within five years, report warns'","b'Five synchronized suicide bombings hit Somalian targets, including a UN building and the Ethiopian embassy.'","b'""The stench went through my nostrils""  - Pub chefs accused of serving human excrement in gelato to a family complaining about noise during a football match. '",b'Israeli biometric database bill passes first vote',b'World Conservation Congress: biodiversity underpins the well-being of human societies and their economies',b'Net giants create code to defend online freedoms',b'UK database guru warns over breaches',"b'This is the Zlin-143, the plane commonly used by the Tamil Tigers\' ""Air Wing"" which today dropped aerial bombs on a Columbo power station and escaped a Sri Lankan air force dragnet.'","b""Venezuela gets its own Satellite! Let's try to find out what it can do!""",b'Young dodge the internet censors',"b""Livni's brave stand""",b'U.S. embassy in Syria says may close to public',b'Extremists face tougher UK entry',b'MI5 targets Irelands al-Qaeda cells',b'Ludmilla Radchenko For The Art Of Being A Woman',b'Scores dead after Pakistan quake',"b""If you guys don't elect Obama, can we have him?""",b'Cops: Centipedes are dangerous weapons'
2008-10-29,0,"b""I Know We've Got This Election in US To Worry, But I Wanted To Help Shine More Light On Our Australian Friends Potential 'Internet Filter' Problem. Let's Keep That In The Spotlight Too!""","b""I can picture in my mind a world without War, a world without Hate. and I can picture us attacking that world, because they'd never expect it. -Jack Handey""",b'British home secretary launches investigation into CIA and MI5 torture which could lead to a criminal prosecution.',"b'Not as important as the US election or aussie internet censorship.. but.. 215 dead, up to 50,000 people may be homeless in Pakistan, following earthquake..'",b'Australia to implement mandatory internet censorship',b'British cave explorers find worlds deepest cave. 1 km. That shit is deep!',"b'Iceland: ""Britain has devastated our economy""'",b'Israeli meseum of tolerance being built on a Muslim graveyard',b'Chinese News reports on RAND proposal for an American war to save the American Economy',b'Jordan woman stabbed to death over sex images',b'Dutch 2008 Commemorative coin (Netherlands and Architecture): beautiful and wonderfully creative',b'(pics) Battles rage in Congo',"b'Losing Afghanistan: After 7 Years of War, the Taliban Attacks the Culture Ministry in Heart of Kabul'","b""And the winner of Bayer's 17th International Childrens Painting Competition is...you guessed it...""",b'China to Talk with Dalai Lama Envoys - Comic',b'War Refugees: Christians On the Run in Iraq',b'Global Fund revokes $10M in anti-AIDS funding and $2M in anti-malaria funding to Uganda over allegations of mismanagement.',b'Not Even Getting Hosed Down Can Stop A Band Of Somalian Pirates',b'Listen online to live audio of CNN TV',b'Scores dead in nine Indian explosions',b'If Walter Cronkite says World Government it must be true',b'Graffiti on a wall between Israel and Palestina',"b""Meanwhile, in the UK, Lesley Douglas, BBC Radio 2 controller, resigns over the Brand/Ross prank call 'scandal'""",b'Israeli army to defend Palestinians from..............Israeli settlers',b'Bomb attacks in India kill at least 67'
2008-10-30,1,b'Out-of-office reply ends up on bilingual road sign in Wales',b' CIA officers could face trial in Britain over torture allegations ',b'teens attack 75 year old blind flamingo - what is wrong with our world?',b'Exxon Posts Largest Ever Profit of $14.83 Billion in a Quarter!',"b""I Know We've Got This Election in US To Worry, But I Wanted To Help Shine More Light On Our Afgani Friends Ongoing 'Us Killing Them' Problem. Let's Keep That In The Spotlight Too!""","b""Priests to face 'sex drive tests'; Pope looks like Sith Lord in photos.""","b'Is the Taliban Stockpiling Opium? And If So, Why? '","b""Berlusconi Guts Italys School System, It's Going From one of Europe's Best to one of Its Worst. """,b'The truth about South Ossetia',"b""Johann Hari: How we fuel Africa's bloodiest war""","b""Worst Terrorist Attack in India's Northeast - 12 separate blasts, with police saying nearly 70 people have died""",b'Australia denies residency to doctor because his son has down syndrome',b'France: Imam arrested for illegal marriages',b'Japan general fired over WWII essay critical of US',b'Suspected US missile strike kills 20 in Pakistan',"b'Police halt wedding of boy, seven, to girl aged five'",b'Syria cut off contacts with Iraq and reduce its forces on the border',"b'Japanese air force chief of staff says the idea that Japan was an aggressor in WWII ""mind control"".  In his view, it was the US that forced Japan into war.'","b'Pakistani police break up the marriage of a 7 and 4 year old, reportedly arranged to end a long-standing family feud.'",b'UK drug abuse worst in Europe',b'Libya has paid $1.5bn into a compensation fund for relatives of US victims of terror attacks blamed on Tripoli.',b'Pirates are back - Seize Boat Crew Off Cameroon ',"b'3000 Year Old ""Spider God"" Temple Found in Peru'","b'Brit becomes Mayor of Spanish town, because every other ruling councillor is arrested for corruption'",b'UK Centre for Social Cohesion press release - The UK government to work with extremist Muslim students'
2008-10-31,1,b'British police ask for camera license!',b'Beheaded after trying for asylum in Australia',b'March of the dustbin Stasi: Half of councils use UK anti-terror laws to watch people putting rubbish out on the wrong day',"b'Amnesty: Somali rape victim, 13, stoned to death, AF '",b'Japanese Air chief sacked over WWII denial',"b""Australian ISPs speak out against government's Great Firewall mandatory content filter""","b""SAS chief quits over 'gross negligence' that killed his troops""",b'Syrians protest against US attack ',"b'""1 million people flee"" fighting in Congo, U.N. says'",b'US airstrikes kill (another) 20 in Pakistani villages',b'Syria has denounced a US strike on its territory but sources say Damascus secretly backed the raid',b'Rescued Royal Bank of  Scotland to pay millions in bonuses',b'GAMBIA: Sex tourists exploiting children',"b'Prostitution: which Approach works - Legalization, or Criminalization?'",b'Banks seek help to forgive some credit card debt',b'Tories pledge to stop UK surveillance powers abuse',"b""Roberte Mugabe supporters grab one of Zimbabwe's last white-run farms""",b'Telling the Truth About Rape in Congo',b'New right-wing Swiss party to enter political arena',b'Christmas Slowly Losing Popularity',b'Mercy Politics: Refugees: The Dire Consequence of Wars and Conflicts.',b'Huge Piece Space station trash plunging to Earth',b'Marriage dowry is major cause of poverty',b'Saddam Hussein the martyr  inside tyrants tomb',"b'Somalia: Rape victim, 13, stoned to death'"
2008-11-03,0,"b'Every MP to receive a copy of Orwell\'s ""Nineteen Eighty-Four""'","b'Scientists conclude a mud volcano that displaced 36,000 Indonesians was caused by exploratory drilling for natural gas.'",b'A bill proposed in Dutch parliament would force women deemed unfit mothers to take contraception for two years.  Fail to comply and the state takes the newborn into custody.',b'Those New Photos of a Healthy Kim Jong-Il suppplied by North Korea..they have no shadows',b'Thousands of Indian farmers are committing suicide after using genetically modified crops ',b'Man dies in hospital after Calgary police use Taser during arrest on weekend',"b'Conflict in Congo, refugees on the move [ Pictures ] '","b'Government to Chinese kids: run at least 1km a day to fight obesity, celebrate Communist party'",b'Modern day little red riding hood: UN reports that Somali woman executed for adultery was instead a raped teen.',"b""German doc moves to Australia to help during doctor shortage; two years later, he's told he can't stay b/c his son has Down's Syndrome""",b'Greenpeace calls off annual harrassment of Japanese whaling ships to concentrate on clearing the reputations of two activists accused of stealing whale meat.',b'At least two bomb blasts have injured more than 60 people in Thailand',b'Dominican migrant: We ate flesh to survive being stranded in the ocean ',b'Israeli troops destroy West Bank settler structures',b'UN finds three internal displacement camps emptied and destroyed in Congo; tens of thousands missing; cholera outbreak possible.',"b'Singapore brings contempt of court case against Wall Street Journal, Dow Jones Publishing.'",b'Guantanamo Jury Sentences Bin Laden Aide to Life',"b""South Korea facing 'kimchi deficit'""","b""Dalai Lama says talks a failure, Tibet 'now dying'""",b'Pakistanis give Gen. Petraeus an earful on his first visit',"b""For sale: Saddam Hussein's luxury yacht""",b'Crisis Creates a New German Politics',"b'Talk or I restart war, Congo rebel tells government'",b'Rebel leader says he will continue fighting towards the Congo capital unless the government agrees to public talks.',"b'Two top state police officers slain in Mexico, where 12 officers have been killed in five days'"
