2009-03-19,0,"b'""In a crowded civilian city, there are all sorts of people who cannot run away: the elderly, the disabled, the pregnant, the terrified. This soldier was told to kill them.""'",b'Obama address the Iranian People',b'Depression-era law lets Iowa turkey farm pay mentally retarded workers 37 cents an hour',"b'Another soldier, describing how a mother and her children were shot dead by a sniper after they turned the wrong way out of a house, says the ""atmosphere"" among troops was that the lives of Palestinians were ""very, very less important than the lives of our soldiers.""'",b'George Galloway banned from Canada',"b""'Don't wear anything that says AIG on it': Under-fire insurer gives employees security tips as fury over bonuses grows""",b'U.N. rights envoy sees Israeli war crimes in Gaza',b'Slaughter of the seals in Russia is stopped by Vladimir Putin',"b'1,417 Gaza war dead named by rights group: Says two-thirds of those killed were civilians; Israel disputes figures'","b'Somalia is a state governed only by anarchy. A graveyard of foreign-policy failures, it has known just six months of peace in the past two decades. Now, as the countrys endless chaos threatens to engulf an entire region, the world again simply watches it burn.'",b'Whistleblower: Barclays makes 1bn a year by tax avoidance.',b'Israel to investigate killings of civilians in Gaza operation...Any guesses how this will turn out?',"b'Japanese ""Suicide Forest""'","b""Sarkozy under Pressure as 'Millions' Take to Streets""",b'You thought the Daily Mail was bad...',"b'Blogger jailed in Iran is dead, lawyer says - CNN.com'","b'nicholas kristof: ""theres pretty good evidence that we generally dont truly want good information  but rather information that confirms our prejudices""'","b""Israel's chief of staff comes home early after doors close in Obama's Washington """,b'The Last Eunuch',b'English takes over at Dutch universities',b'A Perfect Heist',b'Russian planes again fly over U.S. Navy ships',"b'FBI planting spies in U.S. mosques, Muslim groups say'",b'Symantec Overseas credit card scam exposed',b'Thousands of Iraqis held by U.S. to go free'
2009-03-20,0,"b'[pic] Israeli tshirt: kill pregnant women, that way you kill two in one shot'","b""Wow: Sri Lanka's Ministry of Defense have a map of the battle against the Tamil Tigers with photos and timelines... """,b'North Korea confirms American journalists have been arrested',b'Israeli Soldier Says Military Rabbis Framed Gaza Mission as Religious',"b""Israel's 'right of return' applies to all Jews, even ones who don't have ancestors who might have been in Israel from a thousand years ago, yet Israel is the only developed nation on earth which denies refugees 'right of return'""","b""REUTERS: Rabbi's pushed 'religious war against the Gentiles' ""","b""India has the world's highest rate of road fatalities. 70% of those killed are pedestrians and bicyclists. 25% drive motorized two-wheelers.""",b'Billions of pounds of toxic sub-prime mortgages were bought by Royal Bank of Scotland traders in a spree that was not disclosed to the banks board. ',b'Israeli Army T-Shirts Mock Killing Palestinian Women And Children During Gaza Offensive',"b""An increasingly disturbing picture of the Israeli army's conduct in the Gaza war emerged Friday, as new witness accounts from Israeli troops described wanton vandalism to Palestinian homes, humiliation of civilians and loose rules of engagement that resulted in unnecessary civilian deaths.""","b""George Galloway replies: 'Canada can't muzzle me. To ban me from the country for my views on Afghanistan is absurd, hypocritical, and in vain'""","b'Afghanistan is on the brink of chaos: That is the stark message from local leaders, the US military and development workers in the troubled country.'",b'Dubai will one day be seen as a punctuation mark on the architectural follies of the past half century',"b""Israelis told to fight 'holy war' in Gaza""",b'New video and photos provide irrefutable proof of Chinese brutality in Tibet says Tibetan Govt. in-exile',"b""The shadow banking system in Europe isn't so much dead as being kept on life support by banks and central banks in what amounts to a risky attempt to avoid the reckoning.""","b""Tamil Tigers 'finished', says former leader""","b""UK govt's 'sexy' condom campaign -to encourage young women to carry condoms-sparks row""","b""While the modern logical world keeps spinning, the Pope talks about sorcery, spirits, and witchcraft as if it's the 13th century""","b""Israel soldier calls order during Gaza assault 'murder'""","b""North Korea:  Two journalists from Al Gore's Current TV have been detained in North Korea.""",b'Hungary PM to step down',"b'US efforts to eradicate opium poppy crops in Afghanistan have been ""wasteful and ineffective"", the US envoy to Afghanistan and Pakistan says.'",b'Over one million workers protest across France',"b'""Israeli troops admit abuses in Gaza"" TheRealNews'"
2009-03-23,1,"b'Doesnt it seem ironic that in a country with thousands of CCTV cameras, they want to shut down Google Street View because of privacy concerns?'","b'""I find it ironic that on one hand you put [Saddam Hussein] on trial for using biological warfare, but in another country where you sprayed chemicals for warfare, you neglect your responsibility,""'","b""I'm Brit and I'm terrified of my Government's new 'terror strategy'. Someone please get rid of Jacqui Smith""",b'Austria and Hungary reaffirm their sovereign right to ban GM crops',b'Italian court rules that a shepherd smoking marijuana could be justified because he only has sheep for company',b'South Africa denies Dalai Lama visa to attend peace conference. Nobel peace prize winners and committee pull out.',b'Dubai prison mother loses custody',b'Rockefeller Declares War on Free Internet',b'Japanese man  becomes the first person to be certified as a survivor of both Hiroshima and Nagasaki atomic bombings ',"b""China suggests switch from dollar. China's central bank has called for a new global reserve currency run by the IMF to replace the US dollar.""",b'Blackwater sued in US court over alleged cover-up (AFP)',b'China blasts video claiming Tibet violence',"b""Death penalty 'closer to demise'""",b'China bans YouTube',b'U.N. report condemns Israel for Gaza operation',"b'Israel could be guilty of a ""new crime against humanity"" - apparently even Hitler and Pol Pot didn\'t think of that one.'","b'UN accuses Israeli troops of using boy, 11, as human shield'","b""China is calling for a new global currency in place of the dollar ''to achieve the objective of safeguarding global economic and financial stability.''""","b'The number of executions worldwide nearly doubled last year compared to 2007, according to Amnesty International, and China put to death far more people than any other nation. In the Americas, only one state  the United States  consistently executes.'","b'""And that\'s when I proceeded to hit him with the shovel.""'",b'Today we are witnessing the beginning of the US falling from a world superpower',b'Fighting for Life: American Activist Shot by Israelis',"b""The Big Takeover: The global economic crisis isn't about money - it's about power. How Wall Street insiders are using the bailout to stage a revolution""",b'A bit like Northern Ireland: Right-wing Jewish National Front to march through the Arab Israeli city of Umm al-Fahm.',b'At Least 32 Die in a Wave of Violence Across Iraq '
2009-03-24,0,b'China bans Youtube.',"b""Canada is pissed off: Doug Benson, the guy who made fun of the Canadian military on Fox News' Red Eye has to cancel appearance in Edmonton after receiving death threats""",b'Very Interesting Perspective: Letter of Resignation From An Executive Vice President at AIG',"b'How to be Jason Bourne - tips on getting multiple passports, getting a swiss bank account and crossing borders'",b'Where the death penalty was used most last year',"b'THIS NEEDS MORE ATTENTION: Baxter International caught sending mass amounts of deadly, higly virulent live viruses around the world'",b'Crash pilot who paused to pray is convicted',b'Home of former Royal Bank of Scotland boss Sir Fred Goodwin was attacked by vandals overnight.',"b'Benjamin Netanyahu has struck a secret deal with one of his coalition partners, pledging to expand settlements in a highly-contentious area of the West Bank.'","b""Police beat people with sticks....people decide to fight back...see the look on cop's face as he runs like hell""",b'Oldest Woman in world discovered in Kazakhstan',"b'""President Barack Obama is building a road to hell"" - President of the European Union'",b'Christopher Hitchens: Jewish Fundamentalism Is On The Verge Of Taking Over The Middle East',"b'China says video footage that purportedly shows Chinese security personnel violently beating Tibetans last year is ""a lie"".'","b'""Our insatiable demand for illegal drugs fuels the drug trade"" - Hillary Clinton on Mexican drug violence'",b'Riot ensues as right-wing Jewish group marches through the majority Israeli Arab city of Umm al-Fahm demanding that Arab citizens of Israel pledge loyalty to Israel as a Jewish state.',"b'The Israeli army unlawfully fired white phosphorus shells over densely populated areas of the Gaza Strip during its recent offensive, needlessly killing and injuring civilians'",b'Palestinian youth orchestra plays concert for Holocaust survivors in Israel',b'Serbia remembers Nato bombing campaign with air raid sirens',"b""It's not only Madoff and the US where sharks with no scruples ruin lives. Millions in Colombia were recently screwed by Ponzi schemers.""",b'Feds Charge Hacker With Stealing $10 Million From Banks',b'The leadership of the European Union was plunged into disarray last night when the Government holding the rotating presidency collapsed after losing a vote of no confidence in the Czech parliament. ',b'French workers take manager hostage over job cuts -- again',b'Chinese bloggers protest blocking of YouTube',"b'Zealot Israeli settlers are establishing an army within the IDF so Iif the Israeli govt decides to withdraw from the settlements, there will be enough army fundies and rabbis to refuse to obey'"
2009-03-25,1,"b""Mexico's drug war [pics]""","b'An illegal settlement being built, illegal even under Israeli law .'","b'In response to national anger at the death of Polish immigrant Robert Dziekanski in the Vancouver airport, the RCMP was urged to curb Taser use by its officers  but instead removed an existing restriction from its policy - ""It\'s unacceptable it\'s actually moving backwards.""'","b'Pirates have seized two European-owned tankers off the coast of Somalia in the past day, officials have said.'",b'Teacher who exposed school violence is banned from the classroom ',b'Trade in organs from living donors legalized in Singapore',b'Jews Burn Israeli Flag in NY',"b'French workers burned tires, held a manager of 3M hostage as anger mounted over job cuts and executive bonuses'",b'Iran accepts U.S. invitation to Afghanistan meeting',"b'Hillary Clinton - ""Our insatiable demand for illegal drugs fuels the drug trade""'","b'North Korea has placed a long-range missile on a launch pad before a test that the United States, Japan and South Korea said would violate a United Nations Security Council resolution'","b""Israel accused of 'reckless' use of white phosphorus""","b'Gordon Brown gets the roasting he deserves. ""The devalued Prime Minister of a devalued government.""'","b""Iraqi women are suffering a 'silent emergency', trapped in a downward spiral of poverty, desperation and personal insecurity""",b'Thai government set to fall again as thousands rally against prime minister',"b""Gordon Brown, British PM, Pushing Rothschild's Vision Of Global Economy""",b'Top Durban businessmen have been linked to a child prostitution syndicate',b'Cameras film police in Mexico during a drugs shootout where three men were arrested as cocaine and dozens of weapons were seized',"b""Don't attach a saber saw to a sex toy and turn it on near your wifes vagina.  Darwin Award Candidate""",b'Help! My owner is trying to eat me....Britons tempted to eat pets as recession bites',"b""Mother Nature's might seen in Mount Redoubt: Redoubt erupts in major explosive event. Highest aviation warning issued after ash spews 65,000 feet into the air""","b""Outrage in aftermath of China's YouTube censorship""",b'Racist Crime in Russia ',b'One of the men convicted over a milk contamination scandal in China has lost his appeal against the death sentence.',"b""Afghanistan: Manager of private TV network arrested over dancer's skimpy costume """
2009-03-26,1,"b'Defamation of ""Religion"" is now a Human Rights Violation'","b'French riot police officer suspended after listing his favorite interests on Facebook as Crusades, Arab-bashing, Nationalism and the Vichy motto'","b'We have more toilets, less shame among women and less disease.....The results of the No Toilet, No Bride campaign.. '",b'International torch relays ahead of the Olympics have been scrapped by the International Olympic Committee',"b""As Turkey cracks down on 'honour killings', women are now told to commit suicide""",b'Swiss banks ban top exec travel in case they are detained as part of a global crackdown on bank secrecy',b'Girl of 14 accused of child pornography and may be forced to register as a sex offender ',"b'Bomb at Pakistani mosque, at least 48 dead.'",b'British resident who claims he was tortured says senior figures within government must be held to account ',b'Israel suspected in Sudan air strikes',b'Russia sends army to frozen north to claim Arctic resources',"b""Leading medical journal accuses Pope of 'distorting condom science'""",b'U.S. destroyers on move as North Korea prepares rocket launch',b'Noted Author Jared Diamond Predicts 49 Percent Chance of Civilization Collapse',b'Iran and Nato end 30-year impasse ',"b""They'll be telling us next that we'll get cancer unless we stop eating and drinking completely.""",b'Israel bombs civilian convoy in Sudan in order to maintain illegal occupation of Palestine. ',"b""OK England... why don't you raise your kids properly instead of pulling off shit like this?""","b'U.S., Japan mobilize for N. Korean launch - CNN.com'",b' Sudan air strike blamed on Israel',b'The End of Excess: Is This Crisis Good for America?',"b'President Barack Obama plans to send 4,000 more U.S. troops to Afghanistan.'",b'Indian Army fears China attack by 2017 ',"b'Gordon Brown and Buckingham Palace have discussed plans to change the rules of succession to the throne, including giving women equal rights.'","b""Afghanistan exit strategy: more troops and a 'civilian surge'"""
2009-03-27,0,"b'Israeli lie machine goes into overdrive -- Israeli soldiers didn\'t actually shoot a woman and kids that went the wrong way, ""warning shots"" were exaggerated by other soldiers.  Does Israel actually think anybody anywhere buys this crap?'","b""Madoff's wife took $2m from London office before collapse""","b'200 children, some as young as 13, identified as terrorists by British police'","b'WTF?!! UK police uses drastic tactics to identify 200 school children as potential terrorists: ""We are targeting criminals and would-be terrorists who happen to be cloaking themselves in Islamic rhetoric. That is not the same as targeting the Muslim community.""'","b'Iraqi  journalist, ""Shoe Thrower"" selected as one of the top influential people in the Middle East '",b'Cadburys dairy milk have gone fairtrade!',"b""UK police trying to 'smear' peaceful G20 protests""",b'Police officers disguised as Palestinians were attacked by Jewish settlers in the West Bank',b'The Pirate Party Makes a Bid for the European Parliament',b'China celebrates Tibetan liberation.  Is this how history is re-written? ',b'The Associated Press: UN body OKs call to curb religious criticism- more junk from the UN Human Rights Council',b'The Lancet has accused Pope Benedict XVI of distorting scientific evidence to promote Catholic doctrine following his remarks about condom use and HIV.',"b""'Italian Fritzl' and son held for raping daughters: An Italian man and his son have been arrested for raping their own daughters """,b'Spokesperson for Israeli and Jewish causes is jailed for lying to police',"b'Brazilian President Lula de Silva blames ""blue-eyed, white people,"" makes Gordon Brown uncomfortable'",b'US and Iran open Afghanistan peace talks',b'Jews Against Zionism',b'Madagascar protesters tear-gassed for third day',b'Czech prime minister blames AC/DC rock concert for his critical comment of Obama',"b'For first time, CNN in third place in prime time '",b'Egypt releases detained blogger: Secretly held for 7 weeks.',"b""Suburban 'tsunami' kills 77 in Jakarta""","b'Earth Hour 2009 - the Good, the Bad and the Real Point of it All'",b'Harvard researchers agree with Pope Benedict on condoms in Africa',b'Hamas frees rival Fatah leaders in Gaza'
2009-03-30,0,b'Western internet censorship: The beginning of the end or the end of the beginning?',b'In case you were wondering | The Israeli Military finished its investigation of itself and finds no misconduct in Gaza War',"b'Canada To Bush: Yall Dont Come Back Soon! | A few weeks ago, George W. Bush slunk into Calgary, Alberta where he was paid a reported $50,000 to address a group of oil men. Canadians were none too happy.'",b'Mapping the fall of communism',b'A group of pirates got a nasty surprise when they attacked a merchant ship - that turned out to be a German naval vessel.',b'Morocco has expelled five European missionaries for attempting to convert local Muslims to Christianity',b'At least 19 people have died in a crush at a football stadium during a World Cup qualifier in Ivory Coast.',b'Israeli Railways fires Arab workers',"b'A group of researchers from the University of Toronto-based Monk Centre for International Studies have discovered a massive spy system infiltrating more than 1,200 computer systems worldwide, including those of the offices of the Dalai Lama.'",b'Gaza cannot remain an open-air prison forever',"b'One end of the ""tunnel"" emerges next to Tower Bridge on the banks of the Thames in London - the other is next to Brooklyn Bridge on the banks of New York\'s East River.  It looks like something HG Wells might have imagined. '","b'Man takes a disco ball to North Korea: ""I wanted to get a feeling of how far one can go without offending anyone""'",b'Countries who are censoring the internet now',"b'Not just Bay of Pigs and Nicaragua: CIA did the nasty in London, UK'",b'Chinese Police Brutality In Tibet',"b'Obama visits London with an entourage of 500, an armor-plated limousine and a fleet of decoy helicopters'",b'Gunmen storm Pakistan police academy',b'Israel in PR drive to deflect criticism over Gaza deaths',"b'""...the main problem Iran poses to the U.S. is not its nuclear program, but the difficulty of integrating Iran into the web of relationships the U.S. maintains with Irans neighbors and U.S. strategic partners in the region.""'",b'How Russia Made Draft Dodging a Million-Dollar Industry',b'BBC NEWS- Pakistan police academy attacked',b'US reporters face North Korea trial',"b'Pakistan:  20 dead, 25 hurt in Lahore police training school attack'",b'AUS says stay away from Bali',"b'Anarchists in the UK: \'Contrary to mainstream and corporate media unsubstantiated scaremongering campaign claiming the usual ""anarchist groups bound for violence"", the demo passed completely peacefully\' [PICS]'"
2009-03-31,1,"b""If we don't kill them they'll die; the morbidly absurd prosecution of child pornography laws against teenage kids where the only possible victim was themselves""",b'Schoolgirl rapist kneecapped by vigilantes',b'Photographs of White Phosphorus use.',"b""On the eve of the G20 summit, the entire network of central London's wireless CCTV cameras will have to be turned off because of a legal ruling (the reason being they don't fully meet the resolution standards required). ""","b""'Worse than the Taliban' - new law rolls back rights for Afghan women | World news | The Guardian""","b'Libya\'s Gadhafi storms out of Arab League summit. ""I am an international leader, the dean of the Arab rulers, the king of kings of Africa and the imam (leader) of Muslims, and my international status does not allow me to descend to a lower level.""'","b'Netanyahu To Obama: Stop Iran, Or I Will'",b'Spanish Court to Consider Torture Investigation of 6 Bush Officials',"b'Israel closes probe of Gaza incidents, denies they happened'","b""China says GhostNet is fake because the Canadian research was commissioned by the Dalai Lama's office""",b'France is threatening G20 walkout',b'Kucinich to probe $3.6 billion in bonuses at Merrill Lynch',"b""Hundreds of French workers at Caterpillar take their bosses hostage after they're told of layoffs""","b'Should enemy combatants be given legal representation? Lawyers, and political parties, in India dont think so.'","b'European-wide car tracking system planned, creating a system of almost total road surveillance. '","b'No, this is how the stock market really behaves , (and the fact that it is more than 14 months old does it credit)'","b""Muammar Gaddafi accuses Saudi Arabia's King Abdullah of lying at Arab summit""","b""Filmmaker's group makes an awarded movie about Nigerian Scam with only $180""","b'""What is big, loud, unnecessary, and costs $75 million?"" A Group of 20 summit.'",b'Monsanto GM-corn harvest fails massively in South Africa.',"b""People often question the testimonies Palestinians give about how cruely they are treated by the IDF (which so definitely doesn't target civilians), it would be hard to deny Ghada Abu Halima's version of events, given she died as a result of them""","b""The Taliban in Afghanistan are often portrayed as a single, monolithic entity. They're not""",b'The CIA Recruits Spies on the Radio',"b'""Should Japan dare recklessly to intercept the DPRKs satellite, its army will consider this as the start of Japans war of reinvasion more than six decades after the Second World War,"" the official Korean Central News Agency said today.'","b""Here is The People of Freedom, Italy's new conservative party"""
2009-04-01,1,b'I can see PALIN from my REDDIT!',b'Police car travelling at 90mph in a 30mph zone at night without sirens on hit and kills a young girl',"b'Canadian hitman admits 28 deaths. In other news, there are hitmen in Canada.'",b'What rich countries gave in foreign aid last year [chart]',"b'Japan pays jobless foreigners money to go home, they must promise to not return'","b'""Facing mounting U.S. opposition behind the scenes, Israel still plans to continue a covert operation to delay Iran\'s nuclear program by assassinating key Iranian scientists""'",b'New Israeli Foreign Minister Avigdor Lieberman said on Wednesday that Israel was not bound by understandings on the creation of a Palestinian state reached at a U.S.-sponsored conference at Annapolis in November 2007.',b'New Afghan Law to Force Women to Have Sex',b'Tea prices are surging. Is your mug next?',b'Teacher in trouble over thong',"b""North Korea: We'll shoot a rocket! U.S.: We'll shoot down your rocket! North Korea: We'll shoot down your rocket shoot-downers!""","b""Israel Not Obligated to Seek Two-State Solution, Foreign Minister Says (Do they have April Fool's in the Middle East?)""",b'Israel rejects US sponsored peace deal with Palenstine',b'Is it legally apartheid? - the Palestine conundrum',b'Shocker: BMW AG PURCHASES HARLEY-DAVIDSON',"b""Earth population 'exceeds limits'""",b'Somali pirates pick on the wrong ship',b'G20 Terrorist Plot Exposed As Teenagers With Plastic Guns And Fireworks ',b'Foreign minister says Israel not bound to follow two-state path',"b'Russia and US renew nuclear talks, The discussions will be the first such talks for more than a decade.'","b""U.S. Must Draw the Line on Israel's Settlements""",b'Sudan leader on Mecca pilgrimage',b' Sex workers rally against new crime bill',"b'The ""War on Terror"" being phased out - Not enough people convinced, back to older excuses to pass Security Legislation'",b'This sign at the G20 protest in London says it all!'
